"No.","Time","Source","Destination","Protocol","Length","Info"
"1","0.000000000","192.168.8.197","224.0.0.251","MDNS","103","Standard query 0x004c PTR _233637DE._sub._googlecast._tcp.local, ""QM"" question PTR _googlecast._tcp.local, ""QM"" question"
"2","7.881069091","192.168.8.197","239.255.255.250","SSDP","167","M-SEARCH * HTTP/1.1 "
"3","8.188472346","192.168.8.197","239.255.255.250","SSDP","167","M-SEARCH * HTTP/1.1 "
"4","8.497700060","192.168.8.197","239.255.255.250","SSDP","167","M-SEARCH * HTTP/1.1 "
"5","14.429240355","fe80::c2b5:cdff:fe37:3818","ff02::1:ffcc:53dd","ICMPv6","86","Neighbor Solicitation for fe80::9263:3bff:fecc:53dd from c0:b5:cd:37:38:18"
"6","15.558906942","fe80::c2b5:cdff:fe37:3818","ff02::1:ffcc:53dd","ICMPv6","86","Neighbor Solicitation for fdc0:b5cd:3738:1800:9263:3bff:fecc:53dd from c0:b5:cd:37:38:18"
"7","15.577906513","fe80::c2b5:cdff:fe37:3818","ff02::1:ffed:7f26","ICMPv6","86","Neighbor Solicitation for fdc0:b5cd:3738:1800:d6c:dd22:73ed:7f26 from c0:b5:cd:37:38:18"
"8","17.820969091","192.168.8.197","239.255.255.250","SSDP","167","M-SEARCH * HTTP/1.1 "
"9","18.126321290","192.168.8.197","239.255.255.250","SSDP","167","M-SEARCH * HTTP/1.1 "
"10","18.436923791","192.168.8.197","239.255.255.250","SSDP","167","M-SEARCH * HTTP/1.1 "
"11","20.073171117","192.168.8.197","224.0.0.251","MDNS","103","Standard query 0x004d PTR _233637DE._sub._googlecast._tcp.local, ""QM"" question PTR _googlecast._tcp.local, ""QM"" question"
"12","25.645989357","AzureWav_b7:5a:0f","Broadcast","ARP","60","Who has 192.168.8.181? Tell 192.168.8.124"
"13","25.646015259","PcsCompu_5c:d5:3d","AzureWav_b7:5a:0f","ARP","42","192.168.8.181 is at 08:00:27:5c:d5:3d"
"14","25.647866868","192.168.8.124","192.168.8.181","ICMP","74","Echo (ping) request  id=0x0001, seq=13/3328, ttl=128 (reply in 15)"
"15","25.647922694","192.168.8.181","192.168.8.124","ICMP","74","Echo (ping) reply    id=0x0001, seq=13/3328, ttl=64 (request in 14)"
"16","26.648894436","192.168.8.124","192.168.8.181","ICMP","74","Echo (ping) request  id=0x0001, seq=14/3584, ttl=128 (reply in 17)"
"17","26.648951626","192.168.8.181","192.168.8.124","ICMP","74","Echo (ping) reply    id=0x0001, seq=14/3584, ttl=64 (request in 16)"
"18","27.653285292","192.168.8.124","192.168.8.181","ICMP","74","Echo (ping) request  id=0x0001, seq=15/3840, ttl=128 (reply in 19)"
"19","27.653322716","192.168.8.181","192.168.8.124","ICMP","74","Echo (ping) reply    id=0x0001, seq=15/3840, ttl=64 (request in 18)"
"20","27.859598851","192.168.8.197","239.255.255.250","SSDP","167","M-SEARCH * HTTP/1.1 "
"21","28.167304191","192.168.8.197","239.255.255.250","SSDP","167","M-SEARCH * HTTP/1.1 "
"22","28.474424376","192.168.8.197","239.255.255.250","SSDP","167","M-SEARCH * HTTP/1.1 "
"23","28.683214191","192.168.8.124","192.168.8.181","ICMP","74","Echo (ping) request  id=0x0001, seq=16/4096, ttl=128 (reply in 24)"
"24","28.683290137","192.168.8.181","192.168.8.124","ICMP","74","Echo (ping) reply    id=0x0001, seq=16/4096, ttl=64 (request in 23)"
"25","30.732247635","PcsCompu_5c:d5:3d","AzureWav_b7:5a:0f","ARP","42","Who has 192.168.8.124? Tell 192.168.8.181"
"26","30.732728018","AzureWav_b7:5a:0f","PcsCompu_5c:d5:3d","ARP","60","192.168.8.124 is at 70:66:55:b7:5a:0f"
"27","37.900316043","192.168.8.197","239.255.255.250","SSDP","167","M-SEARCH * HTTP/1.1 "
"28","38.207122077","192.168.8.197","239.255.255.250","SSDP","167","M-SEARCH * HTTP/1.1 "
"29","38.514471878","192.168.8.197","239.255.255.250","SSDP","167","M-SEARCH * HTTP/1.1 "
"30","40.050880447","192.168.8.197","224.0.0.251","MDNS","103","Standard query 0x004e PTR _233637DE._sub._googlecast._tcp.local, ""QM"" question PTR _googlecast._tcp.local, ""QM"" question"
"31","40.945365693","HuaweiDe_37:38:18","AzureWav_b7:5a:0f","ARP","60","192.168.8.1 is at c0:b5:cd:37:38:18"
"32","43.795318469","192.168.8.181","192.168.8.1","DNS","78","Standard query 0x9106 A plugins.nessus.org"
"33","43.795476104","192.168.8.181","192.168.8.1","DNS","78","Standard query 0x3203 AAAA plugins.nessus.org"
"34","43.806182416","192.168.8.1","192.168.8.181","DNS","174","Standard query response 0x9106 A plugins.nessus.org CNAME pds-geo.lb.tenablesecurity.com CNAME plugins.cloud.tenable.com A 52.17.55.52"
"35","43.806182515","192.168.8.1","192.168.8.181","DNS","186","Standard query response 0x3203 AAAA plugins.nessus.org CNAME pds-geo.lb.tenablesecurity.com CNAME plugins.cloud.tenable.com AAAA 2c0f:fa18:0:10::3411:3734"
"36","43.808367822","192.168.8.181","52.17.55.52","TCP","74","51820  >  443 [SYN] Seq=0 Win=64240 Len=0 MSS=1460 SACK_PERM=1 TSval=1241297369 TSecr=0 WS=128"
"37","43.957127024","52.17.55.52","192.168.8.181","TCP","74","443  >  51820 [SYN, ACK] Seq=0 Ack=1 Win=28960 Len=0 MSS=1400 SACK_PERM=1 TSval=3456225947 TSecr=1241297369 WS=512"
"38","43.957254657","192.168.8.181","52.17.55.52","TCP","66","51820  >  443 [ACK] Seq=1 Ack=1 Win=64256 Len=0 TSval=1241297518 TSecr=3456225947"
"39","43.965173563","192.168.8.181","52.17.55.52","TLSv1.2","583","Client Hello"
"40","44.189966939","52.17.55.52","192.168.8.181","TLSv1.2","1454","Server Hello"
"41","44.190222428","192.168.8.181","52.17.55.52","TCP","66","51820  >  443 [ACK] Seq=518 Ack=1389 Win=64128 Len=0 TSval=1241297750 TSecr=3456226164"
"42","44.189967029","52.17.55.52","192.168.8.181","TCP","1373","[TCP Previous segment not captured] 443  >  51820 [PSH, ACK] Seq=2777 Ack=518 Win=30208 Len=1307 TSval=3456226164 TSecr=1241297526 [TCP segment of a reassembled PDU], Server Key Exchange, Server Hello Done"
"43","44.190333503","192.168.8.181","52.17.55.52","TCP","78","[TCP Dup ACK 41#1] 51820  >  443 [ACK] Seq=518 Ack=1389 Win=64128 Len=0 TSval=1241297751 TSecr=3456226164 SLE=2777 SRE=4084"
"44","44.336289747","52.17.55.52","192.168.8.181","TCP","1454","[TCP Out-Of-Order] 443  >  51820 [ACK] Seq=1389 Ack=518 Win=30208 Len=1388 TSval=3456226379 TSecr=1241297751"
"45","44.336411525","192.168.8.181","52.17.55.52","TCP","66","51820  >  443 [ACK] Seq=518 Ack=4084 Win=63360 Len=0 TSval=1241297897 TSecr=3456226379"
"46","44.343795977","192.168.8.181","52.17.55.52","TLSv1.2","192","Client Key Exchange, Change Cipher Spec, Encrypted Handshake Message"
"47","44.808803498","192.168.8.181","52.17.55.52","TCP","192","[TCP Retransmission] 51820  >  443 [PSH, ACK] Seq=518 Ack=4084 Win=64128 Len=126 TSval=1241298369 TSecr=3456226379"
"48","44.886615917","52.17.55.52","192.168.8.181","TLSv1.2","324","New Session Ticket, Change Cipher Spec, Encrypted Handshake Message"
"49","44.886660237","192.168.8.181","52.17.55.52","TCP","66","51820  >  443 [ACK] Seq=644 Ack=4342 Win=64128 Len=0 TSval=1241298447 TSecr=3456226922"
"50","44.888389675","192.168.8.181","52.17.55.52","TLSv1.2","538","Application Data"
"51","44.978430300","52.17.55.52","192.168.8.181","TCP","78","[TCP Dup ACK 48#1] 443  >  51820 [ACK] Seq=4342 Ack=644 Win=30208 Len=0 TSval=3456226966 TSecr=1241298369 SLE=518 SRE=644"
"52","45.513089733","192.168.8.181","52.17.55.52","TLSv1.2","704","Application Data"
"53","45.637016944","52.17.55.52","192.168.8.181","TCP","66","[TCP Previous segment not captured] 443  >  51820 [FIN, ACK] Seq=4655 Ack=1754 Win=32768 Len=0 TSval=3456227682 TSecr=1241299074"
"54","45.637176595","192.168.8.181","52.17.55.52","TCP","78","[TCP Dup ACK 49#1] 51820  >  443 [ACK] Seq=1754 Ack=4342 Win=64128 Len=0 TSval=1241299198 TSecr=3456226966 SLE=4655 SRE=4656"
"55","45.646807081","52.17.55.52","192.168.8.181","TCP","379","[TCP Out-Of-Order] 443  >  51820 [PSH, ACK] Seq=4342 Ack=1754 Win=32768 Len=313 TSval=3456227682 TSecr=1241299074"
"56","45.646935178","192.168.8.181","52.17.55.52","TCP","66","51820  >  443 [ACK] Seq=1754 Ack=4656 Win=64128 Len=0 TSval=1241299207 TSecr=3456227682"
"57","45.647932749","192.168.8.181","52.17.55.52","TCP","66","51820  >  443 [RST, ACK] Seq=1754 Ack=4656 Win=64128 Len=0 TSval=1241299208 TSecr=3456227682"
"58","47.837429608","192.168.8.197","239.255.255.250","SSDP","167","M-SEARCH * HTTP/1.1 "
"59","48.144905985","192.168.8.197","239.255.255.250","SSDP","167","M-SEARCH * HTTP/1.1 "
"60","48.452593436","192.168.8.197","239.255.255.250","SSDP","167","M-SEARCH * HTTP/1.1 "
"61","48.809536108","HuaweiDe_37:38:18","Broadcast","ARP","60","Who has 192.168.8.181? Tell 192.168.8.1"
"62","48.809556487","PcsCompu_5c:d5:3d","HuaweiDe_37:38:18","ARP","42","192.168.8.181 is at 08:00:27:5c:d5:3d"
"63","49.866185088","HuaweiDe_37:38:18","Broadcast","ARP","60","Who has 192.168.8.124? Tell 192.168.8.1"
"64","53.873720037","192.168.8.181","192.168.8.1","DNS","78","Standard query 0xe1db A plugins.nessus.org"
"65","53.890759343","192.168.8.1","192.168.8.181","DNS","174","Standard query response 0xe1db A plugins.nessus.org CNAME pds-geo.lb.tenablesecurity.com CNAME plugins.cloud.tenable.com A 52.17.55.52"
"66","53.893358003","192.168.8.181","192.168.8.1","DNS","78","Standard query 0x3ebb A plugins.nessus.org"
"67","53.893500843","192.168.8.181","192.168.8.1","DNS","78","Standard query 0xaec5 AAAA plugins.nessus.org"
"68","53.900798621","192.168.8.1","192.168.8.181","DNS","174","Standard query response 0x3ebb A plugins.nessus.org CNAME pds-geo.lb.tenablesecurity.com CNAME plugins.cloud.tenable.com A 52.17.55.52"
"69","53.900798768","192.168.8.1","192.168.8.181","DNS","186","Standard query response 0xaec5 AAAA plugins.nessus.org CNAME pds-geo.lb.tenablesecurity.com CNAME plugins.cloud.tenable.com AAAA 2c0f:fa18:0:10::3411:3734"
"70","53.901732275","192.168.8.181","52.17.55.52","TCP","74","51822  >  443 [SYN] Seq=0 Win=64240 Len=0 MSS=1460 SACK_PERM=1 TSval=1241307462 TSecr=0 WS=128"
"71","54.031775463","52.17.55.52","192.168.8.181","TCP","74","443  >  51822 [SYN, ACK] Seq=0 Ack=1 Win=28960 Len=0 MSS=1400 SACK_PERM=1 TSval=3456236036 TSecr=1241307462 WS=512"
"72","54.031907916","192.168.8.181","52.17.55.52","TCP","66","51822  >  443 [ACK] Seq=1 Ack=1 Win=64256 Len=0 TSval=1241307592 TSecr=3456236036"
"73","54.050009173","192.168.8.181","52.17.55.52","TLSv1.2","583","Client Hello"
"74","54.191368886","52.17.55.52","192.168.8.181","TLSv1.2","1454","[TCP Previous segment not captured] , Ignored Unknown Record"
"75","54.191406739","192.168.8.181","52.17.55.52","TCP","78","[TCP Dup ACK 72#1] 51822  >  443 [ACK] Seq=518 Ack=1 Win=64256 Len=0 TSval=1241307752 TSecr=3456236036 SLE=1389 SRE=2777"
"76","55.412455975","52.17.55.52","192.168.8.181","TCP","1454","[TCP Retransmission] 443  >  51822 [ACK] Seq=1 Ack=518 Win=30208 Len=1388 TSval=3456237430 TSecr=1241307752"
"77","55.412577639","192.168.8.181","52.17.55.52","TCP","66","51822  >  443 [ACK] Seq=518 Ack=2777 Win=63360 Len=0 TSval=1241308973 TSecr=3456237430"
"78","56.204109376","52.17.55.52","192.168.8.181","TLSv1.2","1373","Ignored Unknown Record"
"79","56.204160922","192.168.8.181","52.17.55.52","TCP","66","51822  >  443 [ACK] Seq=518 Ack=4084 Win=64128 Len=0 TSval=1241309765 TSecr=3456237890"
"80","56.205921154","192.168.8.181","52.17.55.52","TLSv1.2","192","Client Key Exchange, Change Cipher Spec, Encrypted Handshake Message"
"81","56.413899045","52.17.55.52","192.168.8.181","TLSv1.2","324","New Session Ticket, Change Cipher Spec, Encrypted Handshake Message"
"82","56.413941448","192.168.8.181","52.17.55.52","TCP","66","51822  >  443 [ACK] Seq=644 Ack=4342 Win=64128 Len=0 TSval=1241309974 TSecr=3456238371"
"83","56.414583175","192.168.8.181","52.17.55.52","TLSv1.2","793","Application Data"
"84","56.592100341","52.17.55.52","192.168.8.181","TLSv1.2","589","Application Data"
"85","56.592238507","192.168.8.181","52.17.55.52","TCP","66","51822  >  443 [ACK] Seq=1371 Ack=4865 Win=64128 Len=0 TSval=1241310153 TSecr=3456238578"
"86","56.592100470","52.17.55.52","192.168.8.181","TLSv1.2","97","Encrypted Alert"
"87","56.596648610","192.168.8.181","52.17.55.52","TCP","66","51822  >  443 [RST, ACK] Seq=1371 Ack=4897 Win=64128 Len=0 TSval=1241310157 TSecr=3456238578"
"88","56.653998182","192.168.8.181","192.168.8.1","DNS","78","Standard query 0xe05e A plugins.nessus.org"
"89","56.672550870","192.168.8.1","192.168.8.181","DNS","174","Standard query response 0xe05e A plugins.nessus.org CNAME pds-geo.lb.tenablesecurity.com CNAME plugins.cloud.tenable.com A 52.17.55.52"
"90","56.674557946","192.168.8.181","192.168.8.1","DNS","78","Standard query 0x96cf A plugins.nessus.org"
"91","56.674709091","192.168.8.181","192.168.8.1","DNS","78","Standard query 0x29cc AAAA plugins.nessus.org"
"92","56.682273496","192.168.8.1","192.168.8.181","DNS","174","Standard query response 0x96cf A plugins.nessus.org CNAME pds-geo.lb.tenablesecurity.com CNAME plugins.cloud.tenable.com A 52.17.55.52"
"93","56.682273550","192.168.8.1","192.168.8.181","DNS","186","Standard query response 0x29cc AAAA plugins.nessus.org CNAME pds-geo.lb.tenablesecurity.com CNAME plugins.cloud.tenable.com AAAA 2c0f:fa18:0:10::3411:3734"
"94","56.683598199","192.168.8.181","52.17.55.52","TCP","74","51824  >  443 [SYN] Seq=0 Win=64240 Len=0 MSS=1460 SACK_PERM=1 TSval=1241310244 TSecr=0 WS=128"
"95","56.862881760","52.17.55.52","192.168.8.181","TCP","74","443  >  51824 [SYN, ACK] Seq=0 Ack=1 Win=28960 Len=0 MSS=1400 SACK_PERM=1 TSval=3456238807 TSecr=1241310244 WS=512"
"96","56.863025490","192.168.8.181","52.17.55.52","TCP","66","51824  >  443 [ACK] Seq=1 Ack=1 Win=64256 Len=0 TSval=1241310423 TSecr=3456238807"
"97","56.888285405","192.168.8.181","52.17.55.52","TLSv1.2","583","Client Hello"
"98","57.451890197","192.168.8.181","52.17.55.52","TCP","583","[TCP Retransmission] 51824  >  443 [PSH, ACK] Seq=1 Ack=1 Win=64256 Len=517 TSval=1241311012 TSecr=3456238807"
"99","57.552850209","52.17.55.52","192.168.8.181","TLSv1.2","2842","Server Hello"
"100","57.552954466","192.168.8.181","52.17.55.52","TCP","66","51824  >  443 [ACK] Seq=518 Ack=2777 Win=63488 Len=0 TSval=1241311113 TSecr=3456239109"
"101","57.592840984","52.17.55.52","192.168.8.181","TLSv1.2","1373","Certificate, Server Key Exchange, Server Hello Done"
"102","57.592872636","192.168.8.181","52.17.55.52","TCP","66","51824  >  443 [ACK] Seq=518 Ack=4084 Win=64128 Len=0 TSval=1241311153 TSecr=3456239508"
"103","57.594258671","192.168.8.181","52.17.55.52","TLSv1.2","192","Client Key Exchange, Change Cipher Spec, Encrypted Handshake Message"
"104","57.672694907","52.17.55.52","192.168.8.181","TCP","78","[TCP Dup ACK 99#1] 443  >  51824 [ACK] Seq=4084 Ack=518 Win=30208 Len=0 TSval=3456239597 TSecr=1241311012 SLE=1 SRE=518"
"105","57.878016903","192.168.8.197","239.255.255.250","SSDP","167","M-SEARCH * HTTP/1.1 "
"106","58.104091677","52.17.55.52","192.168.8.181","TCP","66","443  >  51824 [ACK] Seq=4084 Ack=644 Win=30208 Len=0 TSval=3456239746 TSecr=1241311155"
"107","58.104091884","52.17.55.52","192.168.8.181","TLSv1.2","324","New Session Ticket, Change Cipher Spec, Encrypted Handshake Message"
"108","58.104156679","192.168.8.181","52.17.55.52","TCP","66","51824  >  443 [ACK] Seq=644 Ack=4342 Win=64128 Len=0 TSval=1241311665 TSecr=3456239746"
"109","58.105175568","192.168.8.181","52.17.55.52","TLSv1.2","786","Application Data"
"110","58.185606863","192.168.8.197","239.255.255.250","SSDP","167","M-SEARCH * HTTP/1.1 "
"111","58.213574296","52.17.55.52","192.168.8.181","TCP","66","[TCP Previous segment not captured] 443  >  51824 [FIN, ACK] Seq=5883 Ack=1364 Win=31744 Len=0 TSval=3456240253 TSecr=1241311666"
"112","58.213648784","192.168.8.181","52.17.55.52","TCP","78","[TCP Dup ACK 108#1] 51824  >  443 [ACK] Seq=1364 Ack=4342 Win=64128 Len=0 TSval=1241311774 TSecr=3456239746 SLE=5883 SRE=5884"
"113","58.224469200","52.17.55.52","192.168.8.181","TCP","1607","[TCP Out-Of-Order] 443  >  51824 [PSH, ACK] Seq=4342 Ack=1364 Win=31744 Len=1541 TSval=3456240253 TSecr=1241311666"
"114","58.224667142","192.168.8.181","52.17.55.52","TCP","66","51824  >  443 [ACK] Seq=1364 Ack=5884 Win=63744 Len=0 TSval=1241311785 TSecr=3456240253"
"115","58.229629890","192.168.8.181","52.17.55.52","TCP","66","51824  >  443 [RST, ACK] Seq=1364 Ack=5884 Win=64128 Len=0 TSval=1241311790 TSecr=3456240253"
"116","58.257158020","192.168.8.181","192.168.8.1","DNS","78","Standard query 0xd9cb A plugins.nessus.org"
"117","58.273049931","192.168.8.1","192.168.8.181","DNS","174","Standard query response 0xd9cb A plugins.nessus.org CNAME pds-geo.lb.tenablesecurity.com CNAME plugins.cloud.tenable.com A 52.17.55.52"
"118","58.274791511","192.168.8.181","192.168.8.1","DNS","78","Standard query 0x9ec3 A plugins.nessus.org"
"119","58.274954183","192.168.8.181","192.168.8.1","DNS","78","Standard query 0xc0c1 AAAA plugins.nessus.org"
"120","58.283129745","192.168.8.1","192.168.8.181","DNS","174","Standard query response 0x9ec3 A plugins.nessus.org CNAME pds-geo.lb.tenablesecurity.com CNAME plugins.cloud.tenable.com A 52.17.55.52"
"121","58.283129865","192.168.8.1","192.168.8.181","DNS","186","Standard query response 0xc0c1 AAAA plugins.nessus.org CNAME pds-geo.lb.tenablesecurity.com CNAME plugins.cloud.tenable.com AAAA 2c0f:fa18:0:10::3411:3734"
"122","58.284956249","192.168.8.181","52.17.55.52","TCP","74","51826  >  443 [SYN] Seq=0 Win=64240 Len=0 MSS=1460 SACK_PERM=1 TSval=1241311845 TSecr=0 WS=128"
"123","58.382754928","52.17.55.52","192.168.8.181","TCP","74","443  >  51826 [SYN, ACK] Seq=0 Ack=1 Win=28960 Len=0 MSS=1400 SACK_PERM=1 TSval=3456240408 TSecr=1241311845 WS=512"
"124","58.382857420","192.168.8.181","52.17.55.52","TCP","66","51826  >  443 [ACK] Seq=1 Ack=1 Win=64256 Len=0 TSval=1241311943 TSecr=3456240408"
"125","58.399541282","192.168.8.181","52.17.55.52","TLSv1.2","583","Client Hello"
"126","58.492914560","192.168.8.197","239.255.255.250","SSDP","167","M-SEARCH * HTTP/1.1 "
"127","58.657942762","52.17.55.52","192.168.8.181","TLSv1.2","1373","[TCP Previous segment not captured] , Ignored Unknown Record"
"128","58.657985455","192.168.8.181","52.17.55.52","TCP","78","[TCP Dup ACK 124#1] 51826  >  443 [ACK] Seq=518 Ack=1 Win=64256 Len=0 TSval=1241312218 TSecr=3456240408 SLE=2777 SRE=4084"
"129","58.657942819","52.17.55.52","192.168.8.181","TCP","2842","[TCP Out-Of-Order] 443  >  51826 [ACK] Seq=1 Ack=518 Win=30208 Len=2776 TSval=3456240564 TSecr=1241311960"
"130","58.658258352","192.168.8.181","52.17.55.52","TCP","66","51826  >  443 [ACK] Seq=518 Ack=4084 Win=62464 Len=0 TSval=1241312219 TSecr=3456240564"
"131","58.659522076","192.168.8.181","52.17.55.52","TLSv1.2","192","Client Key Exchange, Change Cipher Spec, Encrypted Handshake Message"
"132","58.784828194","52.17.55.52","192.168.8.181","TLSv1.2","324","New Session Ticket, Change Cipher Spec, Encrypted Handshake Message"
"133","58.784870043","192.168.8.181","52.17.55.52","TCP","66","51826  >  443 [ACK] Seq=644 Ack=4342 Win=64128 Len=0 TSval=1241312345 TSecr=3456240792"
"134","58.785477837","192.168.8.181","52.17.55.52","TLSv1.2","789","Application Data"
"135","59.139808549","52.17.55.52","192.168.8.181","TLSv1.2","1454","[TCP Previous segment not captured] , Ignored Unknown Record"
"136","59.139852678","192.168.8.181","52.17.55.52","TCP","78","[TCP Dup ACK 133#1] 51826  >  443 [ACK] Seq=1367 Ack=4342 Win=64128 Len=0 TSval=1241312700 TSecr=3456240792 SLE=5730 SRE=7118"
"137","59.139808587","52.17.55.52","192.168.8.181","TLSv1.2","1454","[TCP Previous segment not captured] , Ignored Unknown Record"
"138","59.139987106","192.168.8.181","52.17.55.52","TCP","86","[TCP Dup ACK 133#2] 51826  >  443 [ACK] Seq=1367 Ack=4342 Win=64128 Len=0 TSval=1241312700 TSecr=3456240792 SLE=8506 SRE=9894 SLE=5730 SRE=7118"
"139","59.139808612","52.17.55.52","192.168.8.181","TLSv1.2","1454","[TCP Previous segment not captured] , Ignored Unknown Record"
"140","59.140089494","192.168.8.181","52.17.55.52","TCP","94","[TCP Dup ACK 133#3] 51826  >  443 [ACK] Seq=1367 Ack=4342 Win=64128 Len=0 TSval=1241312701 TSecr=3456240792 SLE=11282 SRE=12670 SLE=8506 SRE=9894 SLE=5730 SRE=7118"
"141","59.139808636","52.17.55.52","192.168.8.181","TLSv1.2","1454","[TCP Previous segment not captured] , Ignored Unknown Record"
"142","59.140180569","192.168.8.181","52.17.55.52","TCP","94","[TCP Dup ACK 133#4] 51826  >  443 [ACK] Seq=1367 Ack=4342 Win=64128 Len=0 TSval=1241312701 TSecr=3456240792 SLE=14058 SRE=15446 SLE=11282 SRE=12670 SLE=8506 SRE=9894"
"143","59.139808660","52.17.55.52","192.168.8.181","TLSv1.2","1454","[TCP Previous segment not captured] , Ignored Unknown Record"
"144","59.140351750","192.168.8.181","52.17.55.52","TCP","94","[TCP Dup ACK 133#5] 51826  >  443 [ACK] Seq=1367 Ack=4342 Win=64128 Len=0 TSval=1241312701 TSecr=3456240792 SLE=16834 SRE=18222 SLE=14058 SRE=15446 SLE=11282 SRE=12670"
"145","59.222304965","52.17.55.52","192.168.8.181","TLSv1.2","1454","Ignored Unknown Record"
"146","59.222348195","192.168.8.181","52.17.55.52","TCP","94","[TCP Dup ACK 133#6] 51826  >  443 [ACK] Seq=1367 Ack=4342 Win=64128 Len=0 TSval=1241312783 TSecr=3456240792 SLE=16834 SRE=19610 SLE=14058 SRE=15446 SLE=11282 SRE=12670"
"147","59.294827481","52.17.55.52","192.168.8.181","TCP","1454","[TCP Out-Of-Order] 443  >  51826 [ACK] Seq=7118 Ack=1367 Win=31744 Len=1388 TSval=3456241281 TSecr=1241312701"
"148","59.294873702","192.168.8.181","52.17.55.52","TCP","94","[TCP Dup ACK 133#7] 51826  >  443 [ACK] Seq=1367 Ack=4342 Win=64128 Len=0 TSval=1241312855 TSecr=3456240792 SLE=7118 SRE=9894 SLE=16834 SRE=19610 SLE=14058 SRE=15446"
"149","59.294827546","52.17.55.52","192.168.8.181","TLSv1.2","1454","Ignored Unknown Record"
"150","59.295349160","192.168.8.181","52.17.55.52","TCP","94","[TCP Dup ACK 133#8] 51826  >  443 [ACK] Seq=1367 Ack=4342 Win=64128 Len=0 TSval=1241312856 TSecr=3456240792 SLE=16834 SRE=20998 SLE=7118 SRE=9894 SLE=14058 SRE=15446"
"151","59.333810573","52.17.55.52","192.168.8.181","TLSv1.2","1454","Ignored Unknown Record"
"152","59.333857169","192.168.8.181","52.17.55.52","TCP","94","[TCP Dup ACK 133#9] 51826  >  443 [ACK] Seq=1367 Ack=4342 Win=64128 Len=0 TSval=1241312894 TSecr=3456240792 SLE=16834 SRE=22386 SLE=7118 SRE=9894 SLE=14058 SRE=15446"
"153","59.454569916","HuaweiDe_37:38:18","AzureWav_b7:5a:0f","ARP","60","192.168.8.1 is at c0:b5:cd:37:38:18"
"154","59.786099742","52.17.55.52","192.168.8.181","TCP","1454","[TCP Retransmission] 443  >  51826 [ACK] Seq=9894 Ack=1367 Win=31744 Len=1388 TSval=3456241466 TSecr=1241312856"
"155","59.786156287","192.168.8.181","52.17.55.52","TCP","94","[TCP Dup ACK 133#10] 51826  >  443 [ACK] Seq=1367 Ack=4342 Win=64128 Len=0 TSval=1241313347 TSecr=3456240792 SLE=7118 SRE=12670 SLE=16834 SRE=22386 SLE=14058 SRE=15446"
"156","59.786099823","52.17.55.52","192.168.8.181","TLSv1.2","1454","Ignored Unknown Record"
"157","59.786363270","192.168.8.181","52.17.55.52","TCP","94","[TCP Dup ACK 133#11] 51826  >  443 [ACK] Seq=1367 Ack=4342 Win=64128 Len=0 TSval=1241313347 TSecr=3456240792 SLE=16834 SRE=23774 SLE=7118 SRE=12670 SLE=14058 SRE=15446"
"158","59.786099875","52.17.55.52","192.168.8.181","TCP","1454","[TCP Out-Of-Order] 443  >  51826 [ACK] Seq=15446 Ack=1367 Win=31744 Len=1388 TSval=3456241466 TSecr=1241312894"
"159","59.786512944","192.168.8.181","52.17.55.52","TCP","86","[TCP Dup ACK 133#12] 51826  >  443 [ACK] Seq=1367 Ack=4342 Win=64128 Len=0 TSval=1241313347 TSecr=3456240792 SLE=14058 SRE=23774 SLE=7118 SRE=12670"
"160","59.894419158","52.17.55.52","192.168.8.181","TCP","1454","443  >  51826 [ACK] Seq=23774 Ack=1367 Win=31744 Len=1388 TSval=3456241922 TSecr=1241313347"
"161","59.894477494","192.168.8.181","52.17.55.52","TCP","86","[TCP Dup ACK 133#13] 51826  >  443 [ACK] Seq=1367 Ack=4342 Win=64128 Len=0 TSval=1241313455 TSecr=3456240792 SLE=14058 SRE=25162 SLE=7118 SRE=12670"
"162","59.894419301","52.17.55.52","192.168.8.181","TLSv1.2","1454","[TCP Previous segment not captured] , Ignored Unknown Record"
"163","59.894775782","192.168.8.181","52.17.55.52","TCP","94","[TCP Dup ACK 133#14] 51826  >  443 [ACK] Seq=1367 Ack=4342 Win=64128 Len=0 TSval=1241313455 TSecr=3456240792 SLE=26550 SRE=27938 SLE=14058 SRE=25162 SLE=7118 SRE=12670"
"164","60.024330672","52.17.55.52","192.168.8.181","TCP","1454","[TCP Retransmission] 443  >  51826 [ACK] Seq=12670 Ack=1367 Win=31744 Len=1388 TSval=3456242021 TSecr=1241313455"
"165","60.024365964","192.168.8.181","52.17.55.52","TCP","86","[TCP Dup ACK 133#15] 51826  >  443 [ACK] Seq=1367 Ack=4342 Win=64128 Len=0 TSval=1241313585 TSecr=3456240792 SLE=7118 SRE=25162 SLE=26550 SRE=27938"
"166","60.024330719","52.17.55.52","192.168.8.181","TLSv1.2","1454","[TCP Previous segment not captured] , Ignored Unknown Record"
"167","60.026486374","192.168.8.181","52.17.55.52","TCP","94","[TCP Dup ACK 133#16] 51826  >  443 [ACK] Seq=1367 Ack=4342 Win=64128 Len=0 TSval=1241313585 TSecr=3456240792 SLE=30714 SRE=32102 SLE=7118 SRE=25162 SLE=26550 SRE=27938"
"168","60.028850161","192.168.8.197","224.0.0.251","MDNS","103","Standard query 0x004f PTR _233637DE._sub._googlecast._tcp.local, ""QM"" question PTR _googlecast._tcp.local, ""QM"" question"
"169","60.144543987","52.17.55.52","192.168.8.181","TLSv1.2","1454","Ignored Unknown Record"
"170","60.144544058","52.17.55.52","192.168.8.181","TCP","1454","[TCP Out-Of-Order] 443  >  51826 [ACK] Seq=4342 Ack=1367 Win=31744 Len=1388 TSval=3456242152 TSecr=1241313585"
"171","60.144930078","192.168.8.181","52.17.55.52","TCP","86","51826  >  443 [ACK] Seq=1367 Ack=25162 Win=47616 Len=0 TSval=1241313705 TSecr=3456242152 SLE=30714 SRE=33490 SLE=26550 SRE=27938"
"172","61.164541394","52.17.55.52","192.168.8.181","TCP","1454","[TCP Retransmission] 443  >  51826 [ACK] Seq=25162 Ack=1367 Win=31744 Len=1388 TSval=3456243030 TSecr=1241313705"
"173","61.164583134","192.168.8.181","52.17.55.52","TCP","78","51826  >  443 [ACK] Seq=1367 Ack=27938 Win=61184 Len=0 TSval=1241314725 TSecr=3456243030 SLE=30714 SRE=33490"
"174","61.257149089","52.17.55.52","192.168.8.181","TCP","1454","[TCP Retransmission] 443  >  51826 [ACK] Seq=29326 Ack=1367 Win=31744 Len=1388 TSval=3456243282 TSecr=1241314725"
"175","61.257187284","192.168.8.181","52.17.55.52","TCP","78","[TCP Window Update] 51826  >  443 [ACK] Seq=1367 Ack=27938 Win=67072 Len=0 TSval=1241314818 TSecr=3456243030 SLE=29326 SRE=33490"
"176","61.346328567","52.17.55.52","192.168.8.181","TLSv1.2","1454","[TCP Previous segment not captured] , Ignored Unknown Record"
"177","61.346374071","192.168.8.181","52.17.55.52","TCP","86","[TCP Window Update] 51826  >  443 [ACK] Seq=1367 Ack=27938 Win=69888 Len=0 TSval=1241314907 TSecr=3456243030 SLE=34878 SRE=36266 SLE=29326 SRE=33490"
"178","62.084936975","52.17.55.52","192.168.8.181","TCP","1454","[TCP Retransmission] 443  >  51826 [ACK] Seq=27938 Ack=1367 Win=31744 Len=1388 TSval=3456244048 TSecr=1241314907"
"179","62.085046885","192.168.8.181","52.17.55.52","TCP","78","51826  >  443 [ACK] Seq=1367 Ack=33490 Win=72832 Len=0 TSval=1241315645 TSecr=3456244048 SLE=34878 SRE=36266"
"180","62.174980627","52.17.55.52","192.168.8.181","TCP","1454","[TCP Retransmission] 443  >  51826 [ACK] Seq=33490 Ack=1367 Win=31744 Len=1388 TSval=3456244207 TSecr=1241315645"
"181","62.175300057","192.168.8.181","52.17.55.52","TCP","66","51826  >  443 [ACK] Seq=1367 Ack=36266 Win=75776 Len=0 TSval=1241315735 TSecr=3456244207"
"182","62.174980724","52.17.55.52","192.168.8.181","TLSv1.2","1454","Ignored Unknown Record"
"183","62.175494489","192.168.8.181","52.17.55.52","TCP","66","51826  >  443 [ACK] Seq=1367 Ack=37654 Win=78592 Len=0 TSval=1241315736 TSecr=3456244207"
"184","62.174980753","52.17.55.52","192.168.8.181","TLSv1.2","1454","Ignored Unknown Record"
"185","62.175794867","192.168.8.181","52.17.55.52","TCP","66","51826  >  443 [ACK] Seq=1367 Ack=39042 Win=81536 Len=0 TSval=1241315736 TSecr=3456244207"
"186","62.265685603","52.17.55.52","192.168.8.181","TLSv1.2","1454","Ignored Unknown Record"
"187","62.265733375","192.168.8.181","52.17.55.52","TCP","66","51826  >  443 [ACK] Seq=1367 Ack=40430 Win=84480 Len=0 TSval=1241315826 TSecr=3456244297"
"188","62.285717207","52.17.55.52","192.168.8.181","TLSv1.2","2842","Ignored Unknown Record"
"189","62.285762277","192.168.8.181","52.17.55.52","TCP","66","51826  >  443 [ACK] Seq=1367 Ack=43206 Win=89984 Len=0 TSval=1241315846 TSecr=3456244307"
"190","62.496520075","52.17.55.52","192.168.8.181","TLSv1.2","2842","Ignored Unknown Record"
"191","62.496575553","192.168.8.181","52.17.55.52","TCP","66","51826  >  443 [ACK] Seq=1367 Ack=45982 Win=95488 Len=0 TSval=1241316057 TSecr=3456244392"
"192","62.496520169","52.17.55.52","192.168.8.181","TLSv1.2","2842","Ignored Unknown Record"
"193","62.496939843","192.168.8.181","52.17.55.52","TCP","66","51826  >  443 [ACK] Seq=1367 Ack=48758 Win=101120 Len=0 TSval=1241316057 TSecr=3456244412"
"194","62.636427963","52.17.55.52","192.168.8.181","TLSv1.2","2842","Ignored Unknown Record"
"195","62.636474046","192.168.8.181","52.17.55.52","TCP","66","51826  >  443 [ACK] Seq=1367 Ack=51534 Win=106624 Len=0 TSval=1241316197 TSecr=3456244616"
"196","62.636428032","52.17.55.52","192.168.8.181","TLSv1.2","2842","Ignored Unknown Record"
"197","62.636740200","192.168.8.181","52.17.55.52","TCP","66","51826  >  443 [ACK] Seq=1367 Ack=54310 Win=112128 Len=0 TSval=1241316197 TSecr=3456244626"
"198","62.736426016","52.17.55.52","192.168.8.181","TCP","5618","443  >  51826 [ACK] Seq=54310 Ack=1367 Win=31744 Len=5552 TSval=3456244777 TSecr=1241316197"
"199","62.736484389","192.168.8.181","52.17.55.52","TCP","66","51826  >  443 [ACK] Seq=1367 Ack=59862 Win=123264 Len=0 TSval=1241316297 TSecr=3456244777"
"200","62.736426176","52.17.55.52","192.168.8.181","TLSv1.2","1454","Ignored Unknown Record"
"201","62.736774967","192.168.8.181","52.17.55.52","TCP","66","51826  >  443 [ACK] Seq=1367 Ack=61250 Win=126208 Len=0 TSval=1241316297 TSecr=3456244777"
"202","62.826450421","52.17.55.52","192.168.8.181","TLSv1.2","2842","Ignored Unknown Record"
"203","62.826503058","192.168.8.181","52.17.55.52","TCP","66","51826  >  443 [ACK] Seq=1367 Ack=64026 Win=131712 Len=0 TSval=1241316387 TSecr=3456244861"
"204","62.826450546","52.17.55.52","192.168.8.181","TLSv1.2","2842","Ignored Unknown Record"
"205","62.826866300","192.168.8.181","52.17.55.52","TCP","66","51826  >  443 [ACK] Seq=1367 Ack=66802 Win=137344 Len=0 TSval=1241316387 TSecr=3456244862"
"206","62.865774500","52.17.55.52","192.168.8.181","TLSv1.2","1454","Ignored Unknown Record"
"207","62.865823785","192.168.8.181","52.17.55.52","TCP","66","51826  >  443 [ACK] Seq=1367 Ack=68190 Win=140160 Len=0 TSval=1241316426 TSecr=3456244881"
"208","62.926019151","52.17.55.52","192.168.8.181","TCP","2842","443  >  51826 [ACK] Seq=68190 Ack=1367 Win=31744 Len=2776 TSval=3456244967 TSecr=1241316387"
"209","62.926070205","192.168.8.181","52.17.55.52","TCP","66","51826  >  443 [ACK] Seq=1367 Ack=70966 Win=141184 Len=0 TSval=1241316487 TSecr=3456244967"
"210","62.926019281","52.17.55.52","192.168.8.181","TLSv1.2","1454","Ignored Unknown Record"
"211","62.926441613","192.168.8.181","52.17.55.52","TCP","66","51826  >  443 [ACK] Seq=1367 Ack=72354 Win=140160 Len=0 TSval=1241316487 TSecr=3456244967"
"212","63.026307739","52.17.55.52","192.168.8.181","TLSv1.2","2842","Ignored Unknown Record"
"213","63.026365616","192.168.8.181","52.17.55.52","TCP","66","51826  >  443 [ACK] Seq=1367 Ack=75130 Win=141184 Len=0 TSval=1241316587 TSecr=3456244977"
"214","63.026307887","52.17.55.52","192.168.8.181","TLSv1.2","1454","Ignored Unknown Record"
"215","63.026738143","192.168.8.181","52.17.55.52","TCP","66","51826  >  443 [ACK] Seq=1367 Ack=76518 Win=140160 Len=0 TSval=1241316587 TSecr=3456244997"
"216","63.026307944","52.17.55.52","192.168.8.181","TLSv1.2","1454","Ignored Unknown Record"
"217","63.026929916","192.168.8.181","52.17.55.52","TCP","66","51826  >  443 [ACK] Seq=1367 Ack=77906 Win=139008 Len=0 TSval=1241316587 TSecr=3456245047"
"218","63.028097164","52.17.55.52","192.168.8.181","TLSv1.2","1454","Ignored Unknown Record"
"219","63.028119053","192.168.8.181","52.17.55.52","TCP","66","51826  >  443 [ACK] Seq=1367 Ack=79294 Win=142208 Len=0 TSval=1241316589 TSecr=3456245047"
"220","63.028097237","52.17.55.52","192.168.8.181","TLSv1.2","1454","Ignored Unknown Record"
"221","63.028363830","192.168.8.181","52.17.55.52","TCP","66","51826  >  443 [ACK] Seq=1367 Ack=80682 Win=141056 Len=0 TSval=1241316589 TSecr=3456245057"
"222","63.176486678","52.17.55.52","192.168.8.181","TLSv1.2","2842","Ignored Unknown Record"
"223","63.176520303","192.168.8.181","52.17.55.52","TCP","66","51826  >  443 [ACK] Seq=1367 Ack=83458 Win=141184 Len=0 TSval=1241316737 TSecr=3456245156"
"224","63.177020609","52.17.55.52","192.168.8.181","TLSv1.2","2842","Ignored Unknown Record"
"225","63.177039768","192.168.8.181","52.17.55.52","TCP","66","51826  >  443 [ACK] Seq=1367 Ack=86234 Win=141184 Len=0 TSval=1241316737 TSecr=3456245167"
"226","63.178032854","52.17.55.52","192.168.8.181","TLSv1.2","2842","Ignored Unknown Record"
"227","63.178060354","192.168.8.181","52.17.55.52","TCP","66","51826  >  443 [ACK] Seq=1367 Ack=89010 Win=141184 Len=0 TSval=1241316739 TSecr=3456245181"
"228","63.266256770","52.17.55.52","192.168.8.181","TLSv1.2","5618","Ignored Unknown Record"
"229","63.266313227","192.168.8.181","52.17.55.52","TCP","66","51826  >  443 [ACK] Seq=1367 Ack=94562 Win=139264 Len=0 TSval=1241316827 TSecr=3456245302"
"230","63.368309710","52.17.55.52","192.168.8.181","TLSv1.2","1454","Ignored Unknown Record"
"231","63.368356084","192.168.8.181","52.17.55.52","TCP","66","51826  >  443 [ACK] Seq=1367 Ack=95950 Win=142208 Len=0 TSval=1241316929 TSecr=3456245302"
"232","63.368309792","52.17.55.52","192.168.8.181","TLSv1.2","1454","Ignored Unknown Record"
"233","63.368711789","192.168.8.181","52.17.55.52","TCP","66","51826  >  443 [ACK] Seq=1367 Ack=97338 Win=141056 Len=0 TSval=1241316929 TSecr=3456245311"
"234","63.368309842","52.17.55.52","192.168.8.181","TLSv1.2","1454","Ignored Unknown Record"
"235","63.368906913","192.168.8.181","52.17.55.52","TCP","66","51826  >  443 [ACK] Seq=1367 Ack=98726 Win=140032 Len=0 TSval=1241316929 TSecr=3456245311"
"236","63.446844812","52.17.55.52","192.168.8.181","TLSv1.2","1454","Ignored Unknown Record"
"237","63.446900141","192.168.8.181","52.17.55.52","TCP","66","51826  >  443 [ACK] Seq=1367 Ack=100114 Win=142208 Len=0 TSval=1241317007 TSecr=3456245396"
"238","63.448456193","52.17.55.52","192.168.8.181","TLSv1.2","1454","Ignored Unknown Record"
"239","63.448478289","192.168.8.181","52.17.55.52","TCP","66","51826  >  443 [ACK] Seq=1367 Ack=101502 Win=142208 Len=0 TSval=1241317009 TSecr=3456245396"
"240","63.448456263","52.17.55.52","192.168.8.181","TLSv1.2","1454","Ignored Unknown Record"
"241","63.448697896","192.168.8.181","52.17.55.52","TCP","66","51826  >  443 [ACK] Seq=1367 Ack=102890 Win=141056 Len=0 TSval=1241317009 TSecr=3456245397"
"242","63.448456308","52.17.55.52","192.168.8.181","TLSv1.2","1454","Ignored Unknown Record"
"243","63.448956730","192.168.8.181","52.17.55.52","TCP","66","51826  >  443 [ACK] Seq=1367 Ack=104278 Win=140032 Len=0 TSval=1241317009 TSecr=3456245397"
"244","63.596877301","52.17.55.52","192.168.8.181","TLSv1.2","2842","Ignored Unknown Record"
"245","63.596913949","192.168.8.181","52.17.55.52","TCP","66","51826  >  443 [ACK] Seq=1367 Ack=107054 Win=141184 Len=0 TSval=1241317157 TSecr=3456245522"
"246","63.596877348","52.17.55.52","192.168.8.181","TLSv1.2","1454","Ignored Unknown Record"
"247","63.605622685","52.17.55.52","192.168.8.181","TLSv1.2","2842","Ignored Unknown Record"
"248","63.605650654","192.168.8.181","52.17.55.52","TCP","66","51826  >  443 [ACK] Seq=1367 Ack=111218 Win=141184 Len=0 TSval=1241317166 TSecr=3456245526"
"249","63.605622720","52.17.55.52","192.168.8.181","TLSv1.2","1454","Ignored Unknown Record"
"250","63.625809319","52.17.55.52","192.168.8.181","TLSv1.2","1454","Ignored Unknown Record"
"251","63.625847211","192.168.8.181","52.17.55.52","TCP","66","51826  >  443 [ACK] Seq=1367 Ack=113994 Win=142208 Len=0 TSval=1241317186 TSecr=3456245562"
"252","63.776032131","52.17.55.52","192.168.8.181","TLSv1.2","1454","Ignored Unknown Record"
"253","63.776032170","52.17.55.52","192.168.8.181","TLSv1.2","1454","Ignored Unknown Record"
"254","63.776032194","52.17.55.52","192.168.8.181","TLSv1.2","1454","Ignored Unknown Record"
"255","63.776574664","192.168.8.181","52.17.55.52","TCP","66","51826  >  443 [ACK] Seq=1367 Ack=118158 Win=142208 Len=0 TSval=1241317337 TSecr=3456245582"
"256","64.087838361","52.17.55.52","192.168.8.181","TLSv1.2","1454","Ignored Unknown Record"
"257","64.087838439","52.17.55.52","192.168.8.181","TLSv1.2","4230","[TCP Previous segment not captured] , Ignored Unknown Record"
"258","64.088001963","192.168.8.181","52.17.55.52","TCP","78","51826  >  443 [ACK] Seq=1367 Ack=119546 Win=140928 Len=0 TSval=1241317648 TSecr=3456245752 SLE=120934 SRE=125098"
"259","64.106349866","52.17.55.52","192.168.8.181","TLSv1.2","1454","Ignored Unknown Record"
"260","64.106401875","192.168.8.181","52.17.55.52","TCP","78","[TCP Dup ACK 258#1] 51826  >  443 [ACK] Seq=1367 Ack=119546 Win=140928 Len=0 TSval=1241317667 TSecr=3456245752 SLE=120934 SRE=126486"
"261","64.150762076","52.17.55.52","192.168.8.181","TLSv1.2","1454","Ignored Unknown Record"
"262","64.150820062","192.168.8.181","52.17.55.52","TCP","78","[TCP Dup ACK 258#2] 51826  >  443 [ACK] Seq=1367 Ack=119546 Win=140928 Len=0 TSval=1241317711 TSecr=3456245752 SLE=120934 SRE=127874"
"263","64.196817327","52.17.55.52","192.168.8.181","TCP","1454","[TCP Out-Of-Order] 443  >  51826 [ACK] Seq=119546 Ack=1367 Win=31744 Len=1388 TSval=3456246221 TSecr=1241317648"
"264","64.196910834","192.168.8.181","52.17.55.52","TCP","66","51826  >  443 [ACK] Seq=1367 Ack=127874 Win=137216 Len=0 TSval=1241317757 TSecr=3456246221"
"265","64.196817365","52.17.55.52","192.168.8.181","TLSv1.2","1454","[TCP Previous segment not captured] , Ignored Unknown Record"
"266","64.197029898","192.168.8.181","52.17.55.52","TCP","78","[TCP Dup ACK 264#1] 51826  >  443 [ACK] Seq=1367 Ack=127874 Win=137216 Len=0 TSval=1241317757 TSecr=3456246221 SLE=129262 SRE=130650"
"267","64.386472915","52.17.55.52","192.168.8.181","TLSv1.2","1454","[TCP Previous segment not captured] , Ignored Unknown Record"
"268","64.386522436","192.168.8.181","52.17.55.52","TCP","86","[TCP Window Update] 51826  >  443 [ACK] Seq=1367 Ack=127874 Win=141056 Len=0 TSval=1241317947 TSecr=3456246221 SLE=132038 SRE=133426 SLE=129262 SRE=130650"
"269","64.428632825","52.17.55.52","192.168.8.181","TLSv1.2","1454","Ignored Unknown Record"
"270","64.428691602","192.168.8.181","52.17.55.52","TCP","86","[TCP Dup ACK 264#2] 51826  >  443 [ACK] Seq=1367 Ack=127874 Win=141056 Len=0 TSval=1241317989 TSecr=3456246221 SLE=132038 SRE=134814 SLE=129262 SRE=130650"
"271","64.428632908","52.17.55.52","192.168.8.181","TCP","1454","[TCP Out-Of-Order] 443  >  51826 [ACK] Seq=127874 Ack=1367 Win=31744 Len=1388 TSval=3456246326 TSecr=1241317757"
"272","64.429054694","192.168.8.181","52.17.55.52","TCP","78","51826  >  443 [ACK] Seq=1367 Ack=130650 Win=138880 Len=0 TSval=1241317989 TSecr=3456246326 SLE=132038 SRE=134814"
"273","64.486716612","52.17.55.52","192.168.8.181","TLSv1.2","1454","[TCP Previous segment not captured] , Ignored Unknown Record"
"274","64.486776567","192.168.8.181","52.17.55.52","TCP","86","[TCP Window Update] 51826  >  443 [ACK] Seq=1367 Ack=130650 Win=140032 Len=0 TSval=1241318047 TSecr=3456246326 SLE=136202 SRE=137590 SLE=132038 SRE=134814"
"275","64.557173047","52.17.55.52","192.168.8.181","TLSv1.2","1454","Ignored Unknown Record"
"276","64.557232848","192.168.8.181","52.17.55.52","TCP","86","[TCP Dup ACK 272#1] 51826  >  443 [ACK] Seq=1367 Ack=130650 Win=140032 Len=0 TSval=1241318118 TSecr=3456246326 SLE=136202 SRE=138978 SLE=132038 SRE=134814"
"277","64.587116136","52.17.55.52","192.168.8.181","TCP","1454","[TCP Out-Of-Order] 443  >  51826 [ACK] Seq=130650 Ack=1367 Win=31744 Len=1388 TSval=3456246611 TSecr=1241318047"
"278","64.587254786","192.168.8.181","52.17.55.52","TCP","78","51826  >  443 [ACK] Seq=1367 Ack=134814 Win=137984 Len=0 TSval=1241318148 TSecr=3456246611 SLE=136202 SRE=138978"
"279","66.687990365","52.17.55.52","192.168.8.181","TCP","1454","[TCP Retransmission] 443  >  51826 [ACK] Seq=134814 Ack=1367 Win=31744 Len=1388 TSval=3456248712 TSecr=1241318148"
